"An establishing shot of the school in a storm",""A tracking shot of Jess walking from the inside of school to outsite","An insert shot of Jess's foot stepping in some mud","A Close Up of Jess's face reacting"
"A tilt shot from the beautiful sky to down to Dustin's smiling face to show him enjohing the weather.",
"A Point of View Shot of point of what is distracting Lila.",
"A tracking shot of someone walking down the hall at a new school.",
"A close up of someone not being able to keep their eyes open.",
"An over the shoulder shot as Julia turns in her paper to her teacher.",
"An extreme close up of dylan's eyes as he watches the clock."]d
